[
  {
    "program_key": "Nereus|Ethereum|Ethereum",
    "published_at": "2026-09-08T12:00:00.000000+00:00",
    "scope": "global",
    "row": {
      "memory_id": "MEM-75ebd429be9b",
      "campaign_id": "ingest:defihacklabs:defihacklabs-20260804-nereus",
      "finding_id": null,
      "snapshot_id": null,
      "created_at": "2026-09-08T12:00:00.000000+00:00",
      "kind": "confirmed",
      "status": "CONFIRMED",
      "pattern": "Proxy Upgrade Attack",
      "bug_class": "upgrade-initializer",
      "cwe": null,
      "evidence_summary": "NereusShapeshiftersMarket NFT marketplace (TransparentUpgradeableProxy 0x6de0...6d73) drained via malicious implementation upgrade. Proxy admin key (0x863b...4076, EIP-7702-delegated EOA) was compromised and used to call ProxyAdmin.upgradeAndCall, swapping implementation to a freshly deployed drainer contract (0x60f8...23d1). Drainer's selector 0x8961ec50 swept entire ETH balance to attacker address. Attacker (0xd9cb...8f5f) extracted 12.74 ETH.\n\n**Attack Tx:** [https://etherscan.io/tx/0x125e0a7046004a5886cd0908907ae85bf8716567b4464e11570d588425b0bc93](https://etherscan.io/tx/0x125e0a7046004a5886cd0908907ae85bf8716567b4464e11570d588425b0bc93)\n\n**Source:** [https://twitter.com/DefimonAlerts/status/2084871269854384356](https://twitter.com/DefimonAlerts/status/2084871269854384356)",
      "partition": "dev",
      "schema_version": 2,
      "rejection_class": null,
      "deciding_propositions": [],
      "promotion_status": "promoted",
      "approved_by": "dataset-ingestion",
      "approved_at": "2026-09-08T12:00:00.000000+00:00"
    }
  },
  {
    "program_key": "UnprotectedArbBot|Base|Base",
    "published_at": "2026-09-08T12:00:00.000000+00:00",
    "scope": "global",
    "row": {
      "memory_id": "MEM-c05f177ee991",
      "campaign_id": "ingest:defihacklabs:defihacklabs-20260730-unprotectedarbbot",
      "finding_id": null,
      "snapshot_id": null,
      "created_at": "2026-09-08T12:00:00.000000+00:00",
      "kind": "confirmed",
      "status": "CONFIRMED",
      "pattern": "Unprotected arbitrary-call forwarder drained via pre-granted WETH allowance",
      "bug_class": "unchecked-external-call",
      "cwe": null,
      "evidence_summary": "UnprotectedArbBot (20260730, Base) was exploited via Unprotected arbitrary-call forwarder drained via pre-granted WETH allowance. Reported loss: 16.623 WETH.",
      "partition": "dev",
      "schema_version": 2,
      "rejection_class": null,
      "deciding_propositions": [],
      "promotion_status": "promoted",
      "approved_by": "dataset-ingestion",
      "approved_at": "2026-09-08T12:00:00.000000+00:00"
    }
  },
  {
    "program_key": "ChainConnect|Ethereum|Ethereum",
    "published_at": "2026-09-08T12:00:00.000000+00:00",
    "scope": "global",
    "row": {
      "memory_id": "MEM-e0633adb0f43",
      "campaign_id": "ingest:defihacklabs:defihacklabs-20260726-chainconnect",
      "finding_id": null,
      "snapshot_id": null,
      "created_at": "2026-09-08T12:00:00.000000+00:00",
      "kind": "confirmed",
      "status": "CONFIRMED",
      "pattern": "Bridge Exploit; ChainConnect (20260726) Bridge Exploit exploit pattern",
      "bug_class": "bridge-message",
      "cwe": null,
      "evidence_summary": "ChainConnect bridge exploited on July 26. Attacker held ~329 ETH for ransom; whitehat agreement reached: attacker returned 280 ETH (85% of total stolen) to 0x840B3De19e3FAB72fa9A168bD8Dd71B678c57989 and retained ~49 ETH (15%) as bounty. Recovery confirmed July 31, 2026.\n\n**Attack Tx:** [https://etherscan.io/tx/0xa6df21e27c5228af87e35122b506751c642fe012b2f61c84e046625718d0c85b](https://etherscan.io/tx/0xa6df21e27c5228af87e35122b506751c642fe012b2f61c84e046625718d0c85b)\n\n**Source:** [https://twitter.com/DefimonAlerts/status/2083213179333534148](https://twitter.com/DefimonAlerts/status/2083213179333534148)",
      "partition": "dev",
      "schema_version": 2,
      "rejection_class": null,
      "deciding_propositions": [],
      "promotion_status": "promoted",
      "approved_by": "dataset-ingestion",
      "approved_at": "2026-09-08T12:00:00.000000+00:00"
    }
  },
  {
    "program_key": "Projekt|Ethereum|Ethereum",
    "published_at": "2026-09-08T12:00:00.000000+00:00",
    "scope": "global",
    "row": {
      "memory_id": "MEM-78e3498efd83",
      "campaign_id": "ingest:defihacklabs:defihacklabs-20260725-projekt",
      "finding_id": null,
      "snapshot_id": null,
      "created_at": "2026-09-08T12:00:00.000000+00:00",
      "kind": "confirmed",
      "status": "CONFIRMED",
      "pattern": "Flash Loan Attack",
      "bug_class": "flash-loan",
      "cwe": null,
      "evidence_summary": "A permissionless 'buy-to-earn' reward vault (0x574f...42cb) was exploited via a flash loan attack. The attacker flash-loaned ~14K WETH from Morpho, used it to manipulate token balances across multiple Uniswap V2 memecoin pairs (Kirby Inu, ROTTSCHILD, etc.), and registered huge fake 'purchase' allocations via the unverified trackPurchase() function. The function read the buyer's token balance delta without verifying actual ETH was spent, allowing the attacker to drain ~301.7 ETH (~$560K) from the vault's reward pool via massWithdraw(). The flash loan was repaid in the same transaction.\n\n**Attack Tx:** [https://etherscan.io/tx/0x90f40d3c3b60370f7287d51d972ef54596c46e98f21af91b03a4e84c5e410f64](https://etherscan.io/tx/0x90f40d3c3b60370f7287d51d972ef54596c46e98f21af91b03a4e84c5e410f64)\n\n**Source:** [https://twitter.com/DefimonAlerts/status/2081781283584106959](https://twitter.com/DefimonAlerts/status/2081781283584106959)",
      "partition": "dev",
      "schema_version": 2,
      "rejection_class": null,
      "deciding_propositions": [],
      "promotion_status": "promoted",
      "approved_by": "dataset-ingestion",
      "approved_at": "2026-09-08T12:00:00.000000+00:00"
    }
  },
  {
    "program_key": "LienFinance|Ethereum|Ethereum",
    "published_at": "2026-09-08T12:00:00.000000+00:00",
    "scope": "global",
    "row": {
      "memory_id": "MEM-71dd80bcbbef",
      "campaign_id": "ingest:defihacklabs:defihacklabs-20260724-lienfinance",
      "finding_id": null,
      "snapshot_id": null,
      "created_at": "2026-09-08T12:00:00.000000+00:00",
      "kind": "confirmed",
      "status": "CONFIRMED",
      "pattern": "Access Control / Bond Minting Flaw",
      "bug_class": "access-control",
      "cwe": null,
      "evidence_summary": "GeneralizedDotc OTC pools drained via permissionless bond group registration and flawed multiset integrity in BondMakerCollateralizedEth.exchangeEquivalentBonds(); attacker-deployed contract minted unbacked bonds with crafted payoff functions, repeated exception bondIDs to mask missing inputs, swapped worthless bonds for USDC via three pre-authorized liquidity pools; _calcRateBondToErc20 oracle inflated bond valuations.\n\n**Attack Tx:** [https://etherscan.io/tx/0xb96d572b557a12f5ef193e88cca86123a6ae1b6e98b0eeee265870c85848e0e7](https://etherscan.io/tx/0xb96d572b557a12f5ef193e88cca86123a6ae1b6e98b0eeee265870c85848e0e7)\n\n**Source:** [https://twitter.com/DefimonAlerts/status/2080531008365920472](https://twitter.com/DefimonAlerts/status/2080531008365920472)",
      "partition": "dev",
      "schema_version": 2,
      "rejection_class": null,
      "deciding_propositions": [],
      "promotion_status": "promoted",
      "approved_by": "dataset-ingestion",
      "approved_at": "2026-09-08T12:00:00.000000+00:00"
    }
  },
  {
    "program_key": "Drips|Ethereum|Ethereum",
    "published_at": "2026-09-08T12:00:00.000000+00:00",
    "scope": "global",
    "row": {
      "memory_id": "MEM-390654a032b0",
      "campaign_id": "ingest:defihacklabs:defihacklabs-20260715-drips",
      "finding_id": null,
      "snapshot_id": null,
      "created_at": "2026-09-08T12:00:00.000000+00:00",
      "kind": "confirmed",
      "status": "CONFIRMED",
      "pattern": "Integer Overflow",
      "bug_class": "precision-rounding",
      "cwe": null,
      "evidence_summary": "Signed-integer cast vulnerability in DaiDripsHub._give() function. Attacker passed amt = 2^128 - reserveBalance, causing int128(amt) to wrap to a negative value. -int128(amt) then became positive, flipping the intended deposit into a reserve withdrawal, draining entire DaiReserve to attacker.\n\n**Attack Tx:** [https://etherscan.io/tx/0xc38a6e2259a85ced94238a0b0a49697992f2a6b8140c28f3fd2343d3d8434130](https://etherscan.io/tx/0xc38a6e2259a85ced94238a0b0a49697992f2a6b8140c28f3fd2343d3d8434130)\n\n**Source:** [https://twitter.com/DefimonAlerts/status/2077085434849411365](https://twitter.com/DefimonAlerts/status/2077085434849411365)",
      "partition": "dev",
      "schema_version": 2,
      "rejection_class": null,
      "deciding_propositions": [],
      "promotion_status": "promoted",
      "approved_by": "dataset-ingestion",
      "approved_at": "2026-09-08T12:00:00.000000+00:00"
    }
  },
  {
    "program_key": "SummerFinance|Ethereum|Ethereum",
    "published_at": "2026-09-08T12:00:00.000000+00:00",
    "scope": "global",
    "row": {
      "memory_id": "MEM-96aa97c6b3f2",
      "campaign_id": "ingest:defihacklabs:defihacklabs-20260706-summerfinance",
      "finding_id": null,
      "snapshot_id": null,
      "created_at": "2026-09-08T12:00:00.000000+00:00",
      "kind": "confirmed",
      "status": "CONFIRMED",
      "pattern": "Share Manipulation",
      "bug_class": "share-price-inflation",
      "cwe": null,